{
  "schema_version": "psb-slsa-build-l2-issuer-bundle/v1",
  "profile_id": "slsa-build-l2",
  "issuer_role": "security-monitor",
  "scope_sha256": "e75cbce01b89a8593197db87886d68ad7f7475e2c7bba3c454c528ddb92fc812",
  "observed_at": "2026-07-29T12:00:00Z",
  "evidence": [
    {
      "code": "storage-probe",
      "type": "storage-probe",
      "uri": "https://evidence.example.invalid/slsa/storage-probe.json",
      "sha256": "7777777777777777777777777777777777777777777777777777777777777777",
      "result": "pass",
      "immutable": true
    }
  ]
}
